{
  "dataset": "issue_routes",
  "schema_version": "1.0",
  "last_updated": "2026-10-17",
  "maintainer": "Member 2 - Legal Research & Verified Support Database",
  "how_to_use": "Each route maps a common user problem to verified law provisions and verified contacts. Every legal_basis entry (law_id + ref) must exist in laws.json key_provisions - the validator enforces this. Steps of type 'practical_tip' are common-sense guidance, not law. Always show the disclaimer and the contacts' verified_on date.",
  "fallback": {
    "when": "No route matches, the user is outside Sindh, or the relevant law is Level B without extracted provisions.",
    "say": "Explain that the assistant cannot give a verified answer for this, and refer the user to free legal advice.",
    "contact_ids": ["slacc-legal-aid-society", "mohr-1099"]
  },
  "routes": [
    {
      "id": "wages-unpaid-or-late",
      "title": "Salary not paid, paid late, or illegally deducted",
      "categories": ["employment"],
      "user_phrases": ["meri tankhwah nahi mili", "do mahine se salary nahi di", "salary se paise kaat liye", "final settlement nahi diya", "salary hamesha late aati hai", "my employer has not paid my salary"],
      "applies_when": "Worker in a factory, industrial or commercial establishment in Sindh. Domestic workers: use domestic-worker-rights.",
      "steps": [
        {"order": 1, "type": "practical_tip", "action": "Collect proof: appointment letter, pay slips or bank statements, attendance records, and messages with the employer.", "legal_basis": [], "contact_ids": []},
        {"order": 2, "type": "legal", "action": "Know the deadline the employer missed: wages are due before the 7th day after the wage period (before the 10th day if more than 1,000 workers); after termination, within 2 working days. Wages must be paid by cheque or bank transfer with a pay slip.", "legal_basis": [{"law_id": "sindh-payment-of-wages-2015", "ref": "s.5(1)"}, {"law_id": "sindh-payment-of-wages-2015", "ref": "s.5(2)"}, {"law_id": "sindh-payment-of-wages-2015", "ref": "s.6"}, {"law_id": "sindh-standing-orders-2015", "ref": "SO 10(2)"}, {"law_id": "sindh-standing-orders-2015", "ref": "SO 16(4)"}], "contact_ids": []},
        {"order": 3, "type": "legal", "action": "Only listed deductions are allowed, and total fines in one wage period cannot exceed 3% of wages.", "legal_basis": [{"law_id": "sindh-payment-of-wages-2015", "ref": "s.7"}, {"law_id": "sindh-payment-of-wages-2015", "ref": "s.8"}], "contact_ids": []},
        {"order": 4, "type": "legal", "action": "File a claim with the Payment of Wages Authority for the area (a Commissioner for Workmen's Compensation or a Directorate of Labour officer). The worker, a lawyer, a union official, a Labour Inspector or the worker's heirs can apply, within 3 years.", "legal_basis": [{"law_id": "sindh-payment-of-wages-2015", "ref": "s.15(1)"}, {"law_id": "sindh-payment-of-wages-2015", "ref": "s.15(2)"}], "contact_ids": ["sindh-labour-department"]},
        {"order": 5, "type": "legal", "action": "The Authority can order payment plus compensation of up to 10 times the amount deducted. Several unpaid workers can file one group application, but compensation in a group application is capped at Rs 10 per worker.", "legal_basis": [{"law_id": "sindh-payment-of-wages-2015", "ref": "s.15(3)"}, {"law_id": "sindh-payment-of-wages-2015", "ref": "s.16"}], "contact_ids": []},
        {"order": 6, "type": "legal", "action": "Either side can appeal the Authority's direction to the Labour Court within 30 days.", "legal_basis": [{"law_id": "sindh-payment-of-wages-2015", "ref": "s.17"}], "contact_ids": []},
        {"order": 7, "type": "contact", "action": "For free legal advice before filing, call SLACC.", "legal_basis": [], "contact_ids": ["slacc-legal-aid-society"]}
      ],
      "deadlines": [
        {"what": "Claim before the Payment of Wages Authority", "limit": "3 years from the deduction or due date (later only with sufficient cause)", "legal_basis": {"law_id": "sindh-payment-of-wages-2015", "ref": "s.15(2)"}},
        {"what": "Appeal to the Labour Court", "limit": "30 days from the Authority's direction", "legal_basis": {"law_id": "sindh-payment-of-wages-2015", "ref": "s.17"}}
      ],
      "contact_ids": ["sindh-labour-department", "slacc-legal-aid-society"],
      "emergency": false,
      "caveats": [
        "Agreements giving up these rights are void (Payment of Wages Act s.23).",
        "Trans-provincial employers may fall under federal law - see federal-industrial-relations-2012."
      ]
    },
    {
      "id": "paid-below-minimum-wage",
      "title": "Paid less than the minimum wage",
      "categories": ["employment"],
      "user_phrases": ["minimum wage se kam tankhwah", "mujhe sirf 25 hazar dete hain", "kam se kam tankhwah kitni hai", "aurat ko mard se kam tankhwah", "am I paid below minimum wage"],
      "applies_when": "Worker in an industrial or commercial establishment in Sindh (not Government employees).",
      "steps": [
        {"order": 1, "type": "legal", "action": "Compare the pay with the current notified minimum wage (read it from current_rates.json). Minimum wage includes basic pay plus statutory allowances.", "legal_basis": [{"law_id": "sindh-minimum-wages-2015", "ref": "s.2(xv)"}, {"law_id": "sindh-minimum-wages-2015", "ref": "s.6"}], "contact_ids": []},
        {"order": 2, "type": "legal", "action": "No employer may pay below the notified minimum; workers already on higher pay keep it.", "legal_basis": [{"law_id": "sindh-minimum-wages-2015", "ref": "s.9(1)"}, {"law_id": "sindh-minimum-wages-2015", "ref": "s.9(2)"}], "contact_ids": []},
        {"order": 3, "type": "legal", "action": "Claim the shortfall before the Minimum Wages Authority within 6 months of the due date (up to 1 year with sufficient cause); the Authority can add a penalty of up to 10 times the wages withheld.", "legal_basis": [{"law_id": "sindh-minimum-wages-2015", "ref": "s.10"}], "contact_ids": ["sindh-labour-department"]},
        {"order": 4, "type": "legal", "action": "Appeal against the Authority's order to the Labour Court within 30 days.", "legal_basis": [{"law_id": "sindh-minimum-wages-2015", "ref": "s.11"}], "contact_ids": []},
        {"order": 5, "type": "legal", "action": "Underpaying is also a criminal offence (up to 6 months' imprisonment and/or a fine of Rs 20,000-50,000, plus the shortfall), and paying women less than men in minimum wages is separately fined.", "legal_basis": [{"law_id": "sindh-minimum-wages-2015", "ref": "s.9(3)"}, {"law_id": "sindh-minimum-wages-2015", "ref": "s.15(4)"}], "contact_ids": []}
      ],
      "deadlines": [
        {"what": "Minimum wage claim before the Authority", "limit": "6 months from the due date (up to 1 year with sufficient cause)", "legal_basis": {"law_id": "sindh-minimum-wages-2015", "ref": "s.10"}},
        {"what": "Appeal to the Labour Court", "limit": "30 days", "legal_basis": {"law_id": "sindh-minimum-wages-2015", "ref": "s.11"}}
      ],
      "contact_ids": ["sindh-labour-department", "slacc-legal-aid-society"],
      "emergency": false,
      "caveats": ["Hourly and daily minimum rates for 2026-27 are not yet verified - quote only the monthly rate."]
    },
    {
      "id": "fired-or-terminated",
      "title": "Fired, terminated or forced out of a job",
      "categories": ["employment"],
      "user_phrases": ["mujhe naukri se nikal diya", "bina notice ke nikala", "boss ne kaha kal se mat aana", "zabardasti resign karwaya", "termination letter nahi diya", "gate band kar diya"],
      "applies_when": "Worker in an industrial or commercial establishment in Sindh with 10 or more workers.",
      "steps": [
        {"order": 1, "type": "legal", "action": "Check the worker's class: permanent (long-term work, after completing 3 months' probation) or probationer, temporary, badli or contract.", "legal_basis": [{"law_id": "sindh-standing-orders-2015", "ref": "s.1(4)"}, {"law_id": "sindh-standing-orders-2015", "ref": "SO 1"}], "contact_ids": []},
        {"order": 2, "type": "legal", "action": "A permanent worker terminated for a reason other than misconduct must get one month's notice or one month's wages in lieu. Temporary, probationer, badli and contract workers are not entitled to notice.", "legal_basis": [{"law_id": "sindh-standing-orders-2015", "ref": "SO 16(1)"}, {"law_id": "sindh-standing-orders-2015", "ref": "SO 16(2)"}], "contact_ids": []},
        {"order": 3, "type": "legal", "action": "Termination must be by a written order that states the reason - ask for it in writing.", "legal_basis": [{"law_id": "sindh-standing-orders-2015", "ref": "SO 16(3)"}], "contact_ids": []},
        {"order": 4, "type": "legal", "action": "Dismissal for misconduct requires a written charge within one month, a chance to explain and an independent inquiry; suspension cannot exceed 4 weeks in total and is on full pay.", "legal_basis": [{"law_id": "sindh-standing-orders-2015", "ref": "SO 21(3)"}, {"law_id": "sindh-standing-orders-2015", "ref": "SO 21(4)"}, {"law_id": "sindh-standing-orders-2015", "ref": "SO 21(5)"}], "contact_ids": []},
        {"order": 5, "type": "legal", "action": "Final wages and dues are due within 2 working days; gratuity of one month's wages per completed year (unless dismissed for misconduct or covered by a matching provident fund); the full provident fund balance; and a service certificate for permanent workers.", "legal_basis": [{"law_id": "sindh-standing-orders-2015", "ref": "SO 16(4)"}, {"law_id": "sindh-standing-orders-2015", "ref": "SO 16(6)"}, {"law_id": "sindh-standing-orders-2015", "ref": "SO 16(7)"}, {"law_id": "sindh-standing-orders-2015", "ref": "SO 17"}], "contact_ids": []},